{
  "schema_version": "adapter-manifest.v1",
  "generated_utc": "2026-05-04T14:54:23Z",
  "source_index": "catalog/generated/action-index.json",
  "source_action_count": 5000,
  "sample_count": 10,
  "bounded_preview": true,
  "boundary": {
    "safety_class": "evidence_only",
    "mutation_allowed": false,
    "live_platform_calls_allowed": false,
    "secrets_allowed": false,
    "raw_target_lists_allowed": false,
    "network_scan_allowed": false
  },
  "adapters": [
    "ai/action-contract.sample.json",
    "human/runbook.sample.md",
    "ansible/playbook.sample.yml",
    "awx/job-template.sample.json",
    "aws/ssm-document.sample.yaml",
    "servicenow/import-set.sample.json",
    "cmdb/ci-evidence-mapping.sample.json"
  ],
  "sample_actions": [
    {
      "action_id": "ENDUSER_GET_USER_COMPUTER_CONTEXT_V1",
      "action_number": 1,
      "script_path": "action-layers/windows/end-user/diagnostics-v1/scripts/checks/01-Get-UserComputerContext.ps1",
      "script_sha256": "3bd65de4818da4b0429bfa74c24602cefc68f3ae88dbf6b39d02bf75de343f15"
    },
    {
      "action_id": "ENDUSER_GET_NETWORK_ADAPTER_STATUS_V1",
      "action_number": 2,
      "script_path": "action-layers/windows/end-user/diagnostics-v1/scripts/checks/02-Get-NetworkAdapterStatus.ps1",
      "script_sha256": "ea2e96f9285992c6e1f83df305fc661feb2c82386b81f3cb6fe246289c2b6742"
    },
    {
      "action_id": "ENDUSER_GET_DNS_CLIENT_SUMMARY_V1",
      "action_number": 3,
      "script_path": "action-layers/windows/end-user/diagnostics-v1/scripts/checks/03-Get-DnsClientSummary.ps1",
      "script_sha256": "b8b3b76cd54055014a2bbbf70730de35e93dd92cbb955fa5ef12802393555658"
    },
    {
      "action_id": "ENDUSER_TEST_DNS_RESOLVE_NAME_V1",
      "action_number": 4,
      "script_path": "action-layers/windows/end-user/diagnostics-v1/scripts/checks/04-Test-DnsResolveName.ps1",
      "script_sha256": "fc475c8b83bf025935584e905a1407da37491cfc7b82468d10b8b4f1658fd9aa"
    },
    {
      "action_id": "ENDUSER_TEST_PING_TARGET_V1",
      "action_number": 5,
      "script_path": "action-layers/windows/end-user/diagnostics-v1/scripts/checks/05-Test-PingTarget.ps1",
      "script_sha256": "f0f3b7130b44546c006a8f0c1eacf16b98c21daa7f576844279bf10bbb083302"
    },
    {
      "action_id": "ENDUSER_TEST_TCP_PORT_V1",
      "action_number": 6,
      "script_path": "action-layers/windows/end-user/diagnostics-v1/scripts/checks/06-Test-TcpPort.ps1",
      "script_sha256": "0e73726f13957735cb10e28360a4059a5d4e257da47d9f1a8100bcf8b6fd0904"
    },
    {
      "action_id": "ENDUSER_TEST_URL_STATUS_V1",
      "action_number": 7,
      "script_path": "action-layers/windows/end-user/diagnostics-v1/scripts/checks/07-Test-UrlStatus.ps1",
      "script_sha256": "3a02dc26568f868aef56f24ccf208deee1a08b73508e7daf3e0c062068e52c22"
    },
    {
      "action_id": "ENDUSER_TEST_UNC_PATH_ACCESS_V1",
      "action_number": 8,
      "script_path": "action-layers/windows/end-user/diagnostics-v1/scripts/checks/08-Test-UncPathAccess.ps1",
      "script_sha256": "55b373da505340118791bd37b0186481eff2cb0b375219bca2de50622619872d"
    },
    {
      "action_id": "ENDUSER_OPEN_UNC_PARENT_FOLDER_V1",
      "action_number": 9,
      "script_path": "action-layers/windows/end-user/diagnostics-v1/scripts/checks/09-Open-UncParentFolder.ps1",
      "script_sha256": "3cf4f95fcc64a92fa789d2f9f25c032aba7aa5af3980ad316e35e1d8c6398945"
    },
    {
      "action_id": "ENDUSER_GET_MAPPED_DRIVES_V1",
      "action_number": 10,
      "script_path": "action-layers/windows/end-user/diagnostics-v1/scripts/checks/10-Get-MappedDrives.ps1",
      "script_sha256": "a91c6f83946428679a2434ea629eecb64ac7fb4ba7891fb6c4bf58e96eba8ee6"
    }
  ]
}
